{
  "version_schema": 1,
  "chapitre": 9,
  "resume_court": "Chez les Campardon, Rose obtient la réconciliation avec sa cousine Gasparine, demoiselle au Bonheur des Dames, puis l'installe chez eux par surprise pendant un voyage de son mari à Évreux. Octave, de trop, décide de manger ailleurs. Chez les Pichon, il apprend que Marie est enceinte de cinq mois et offre au ménage un dîner au Bœuf à la mode, rendant ainsi Marie à Jules. Le lendemain, il tente le grand coup auprès de Mme Hédouin en lui proposant d'agrandir le magasin, mais elle le repousse calmement ; vexé, il quitte la maison. Après une visite du chantier du Calvaire avec l'abbé Mauduit, il surprend Campardon et Gasparine s'embrassant. Le soir, seul et blessé, il accepte l'offre de Berthe et d'Auguste d'entrer chez eux.",
  "scenes": [
    {
      "id": "s1",
      "titre": "Le retour de Gasparine chez les Campardon",
      "lieu": "Appartement des Campardon (salle à manger, puis salon)",
      "moment": "Deux jours plus tard, de sept heures à onze heures du soir",
      "personnages_presents": [
        "octave-mouret",
        "rose-campardon",
        "achille-campardon",
        "angele",
        "lisa",
        "gasparine"
      ],
      "deroule": "Deux jours plus tard, vers sept heures, Octave arrive chez les Campardon pour dîner et trouve Rose seule, en peignoir de soie crème. Rose lui demande s'il ne trouve pas Achille triste ; Octave le croit préoccupé par les travaux de Saint-Roch. Campardon arrive en retard, accusant un imbécile de l'avoir retenu, et assure tout bas à Rose qu'« elle » va venir. Au dîner, on parle de l'anglais qu'Angèle apprend depuis quinze jours, et le rôti, oublié au feu par Victoire, est immangeable. Au dessert, Lisa annonce la cousine de madame : Gasparine entre, en robe de laine noire, et Rose l'embrasse en lui proposant de tout oublier. Angèle embrasse sa cousine d'un air maussade puis suit Lisa, qui lance : « ça va devenir drôle, ici ! ». Au salon, Campardon assure à Octave, devant la fenêtre, que c'est Rose qui a voulu la réconciliation, tandis que les deux cousines évoquent Plassans sur le canapé. Rose pleure sur sa santé, Gasparine la console, et Campardon les embrasse toutes deux : « il n'y a encore que la famille ! ». Vers onze heures, Rose raccompagne Gasparine et lui crie de revenir souvent.",
      "enjeu": "Rose veut se réconcilier avec sa cousine Gasparine et a obtenu que Campardon aille la chercher ; Campardon, gêné, se défend d'en avoir eu l'idée. La soirée finit dans l'attendrissement.",
      "regroupements": [
        {
          "personnages": [
            "achille-campardon",
            "rose-campardon"
          ],
          "action": "Octave s'écarte ; Campardon et Rose échangent à voix basse quelques mots sur la venue d'une femme qu'il lui avait promise.",
          "extraits": [
            "Octave s’était écarté, et il les entendit échanger quelques mots à voix basse.",
            "Tu m’avais juré qu’elle viendrait."
          ]
        },
        {
          "personnages": [
            "angele",
            "lisa"
          ],
          "action": "Au moment de passer au salon, Angèle préfère suivre Lisa, qui ferme violemment la porte en disant que ça va devenir drôle.",
          "extraits": [
            "elle préféra suivre Lisa, qui fermait violemment la porte, en disant, sans même craindre d’être entendue",
            "Ah bien ! ça va devenir drôle, ici !"
          ]
        },
        {
          "personnages": [
            "achille-campardon",
            "octave-mouret"
          ],
          "action": "Campardon emmène Octave devant la fenêtre pour le convaincre que la réconciliation vient de Rose et qu'il a peur des histoires.",
          "extraits": [
            "Et, comme s’il eût senti le besoin de convaincre Octave, il l’emmena devant la fenêtre."
          ]
        },
        {
          "personnages": [
            "rose-campardon",
            "gasparine"
          ],
          "action": "Rose et Gasparine s'assoient côte à côte sur le canapé et parlent du passé à Plassans, chez le père Domergue, puis de la santé de Rose.",
          "extraits": [
            "Cependant, Rose et Gasparine s’étaient assises côte à côte sur le canapé.",
            "Elles parlaient du passé, des jours vécus à Plassans, chez le bon père Domergue."
          ]
        }
      ],
      "phrase_finale": "Reviens souvent ! cria-t-elle."
    },
    {
      "id": "s2",
      "titre": "Au Bonheur des Dames : Octave piétine",
      "lieu": "Le Bonheur des Dames",
      "moment": "Le lendemain et les semaines suivantes",
      "personnages_presents": [
        "octave-mouret",
        "gasparine",
        "mme-hedouin"
      ],
      "deroule": "Le lendemain, au Bonheur des Dames, Octave essaie de faire parler Gasparine pendant un arrivage de lingerie, mais elle lui répond d'une voix brève, fâchée qu'il ait été témoin de la veille. Elle a compris depuis longtemps qu'il fait la cour à Mme Hédouin et le surveille avec des regards noirs. Octave s'était donné six mois pour conquérir la patronne ; quatre à peine sont passés et il s'impatiente. Mme Hédouin l'estime pour ses idées de grands comptoirs modernes et le consulte le matin, ce qui crée entre eux une intimité commerciale. Sa tactique est de la vaincre au milieu de l'émotion d'une vente inespérée, et il cherche un coup étonnant. M. Hédouin, malade, part aux eaux de Vichy ; mais sa femme, loin de s'attendrir, se montre plus active que jamais, la plume à l'oreille. En attendant, Octave garde Marie, tout en songeant à la rendre à Jules pour rompre sans brutalité.",
      "enjeu": "Octave veut devenir l'amant de Mme Hédouin en la touchant par le commerce, mais elle reste froide et Gasparine le surveille ; il prépare en même temps sa rupture avec Marie.",
      "regroupements": [
        {
          "personnages": [
            "mme-hedouin",
            "octave-mouret"
          ],
          "action": "Le matin, quand son mari n'est pas là, Mme Hédouin retient Octave pour ouvrir la correspondance avec lui et le consulter.",
          "extraits": [
            "Souvent, lorsque son mari n’était pas là et qu’elle ouvrait la correspondance avec le jeune homme, le matin, elle le retenait, le consultait, se trouvait bien de ses avis"
          ]
        }
      ],
      "phrase_finale": "Pourtant, il attendait, il ne voulait pas se trouver sans femme."
    },
    {
      "id": "s3",
      "titre": "Gasparine s'installe chez les Campardon",
      "lieu": "Appartement des Campardon",
      "moment": "Trois semaines plus tard, au retour d'Évreux de Campardon (déjeuner et après-midi)",
      "personnages_presents": [
        "octave-mouret",
        "rose-campardon",
        "achille-campardon",
        "gasparine",
        "angele",
        "lisa"
      ],
      "deroule": "Depuis trois semaines, Gasparine prend de plus en plus d'autorité chez les Campardon : elle vient chaque soir, puis au déjeuner, et se charge de l'éducation d'Angèle et des provisions. Rose répète qu'elle voudrait la loger chez eux, mais Campardon refuse, rougissant de scrupule : il faudrait lui donner son cabinet. Il répète à Octave : « Quand on est bien, on a tort de vouloir être mieux. » Campardon part deux jours à Évreux, inquiet des travaux de l'archevêché et du prix de la chaire. Il rentre plus tôt que prévu, en plein déjeuner, et trouve un air de mystère : Lisa ferme la porte du salon, Gasparine cache des papiers du pied. Rose, tremblante, lui montre un lit d'acajou installé à la place de sa table à dessiner : c'était une surprise. Gasparine propose de s'en aller, mais Campardon déclare que tout ce que Rose fait est bien fait, et tout le monde s'embrasse. Octave remarque la prévenance de Lisa envers Gasparine. L'après-midi, Campardon organise joyeusement la chambre de la cousine ; Octave, se sentant de trop, décide de ne plus prendre ses repas chez eux.",
      "enjeu": "Rose veut que Gasparine vienne loger chez eux et met Campardon devant le fait accompli ; il accepte avec une joie qui gêne Octave, lequel décide de partir.",
      "regroupements": [
        {
          "personnages": [
            "achille-campardon",
            "gasparine",
            "rose-campardon"
          ],
          "action": "L'après-midi, Campardon et Gasparine installent ensemble la chambre de la cousine, tandis que Rose, assise, leur donne des conseils.",
          "extraits": [
            "Celle-ci l’aidait, poussait les meubles avec lui, déballait le linge, secouait les vêtements",
            "pendant que Rose, assise de peur de se fatiguer, leur donnait des conseils"
          ]
        }
      ],
      "phrase_finale": "D’ailleurs, il était décidé : le lendemain, il remercierait Mme Campardon de sa bonne hospitalité, en inventant une histoire."
    },
    {
      "id": "s4",
      "titre": "Chez les Pichon : la grossesse de Marie",
      "lieu": "Logement des Pichon, puis le restaurant du Bœuf à la mode",
      "moment": "Le même jour, de cinq heures à onze heures du soir",
      "personnages_presents": [
        "octave-mouret",
        "jules-pichon",
        "marie-pichon",
        "mme-vuillaume",
        "m-vuillaume",
        "lilitte"
      ],